short_title,title,series,Idea,genre,author_voice,protagonist,antagonist,good_guys,bad_guys,locations,themes,revelations,character_arcs,mcguffins,plot_twists,special_instructions,num_chapters,num_scenes_per_chapter,num_tokens_total
5GW Cadet,,,Novel showing kids the path to becoming successful fifth-generation warriors.,middle grade,,,,,,,,,,,,,3,3,20000
Exits,Exits: ,,a novel about a team of founders aged 70 and above who create a successful startup.,, ,,,,,Silicon Valley; Phoenix; Northern Michigan,,,,,,,3,3,70000
Titivillicus,"Titivillicus: a novel about the demon Titivillus, who works on behalf of Belphegor, Lucifer or Satan to introduce errors into the work of writers, editors, and publishers.",,,,,,,,,,,,,,,,3,3,70000
The Library of Unwritten Books,The Library of Unwritten Books: for a compendium of wonderful books that are as yet unwritten.,,,,,,,,,,,,,,,,13,5,70000
The Book of Death,The Book of Death,,"s: Encounters with DEATH, the Grim Reaper, in the spirit of Terry Pratchett and the Brothers Grimm.",,,Death,,,,,,,,,,,13,5,70000
If They Had Lived,If They Had Lived,,: after-death biographies of famous figures,,,,,,,,,,,,,,13,5,70000
Residuals,Residuals,,Mystery novel with actor as protagonist: Series.  ,,,Actor is recurring player on Seinfeld -- the fifth wheel.,,,,,,,,,,,13,5,70000
Every Chinese Emperor: ,Every Chinese Emperor: ,,Biographies of every single Chinese emperor,,Pro-Chinese.,,,,,,,,,,,,13,5,70000
The Knightsbridge Classics:,The Knightsbridge Classics:,," Classics reissued in the spirit of the Knightsbridge neighborhood of London -- rich, international, luxurious.",,,,,,,,1920s design,,,,,,13,5,70000
McClurg Reborn,McClurg Reborn,,Books from the publishing company McClurg rebooted & reborn,,,,,; WE Dubois; Edgar Rice Burroughs,,,,,,Lost Tarzan manuscript by  DuBois & Burroughs,,,13,5,70000
Virtual Heritages,,,A pioneer creates a global network of diistributed & aggregated world heritage sites.,nonfiction,,,,,,,,,,,,,8,5,20000
Gaza Survivor,,,They survived the Israeli bombing of Gaza and grew up to bring peace by nonviolence.,middle grade,,,,,,,,,,,,,8,5,20000
Amalek Avenger,,,A young Jewish American boy must set a new course for his life in the aftermath of the 10/7 atrocities.,,,,,,,,,,,,,,8,5,20000
Airplane! 2024,Trump Book!,,An Airplane!-style sendup of political journalist books.,"political humor, politics","Juvenile, very much like the ZAZ team for Airplane! But the Emily Fur character is always relatable and her reactions always seem genuine to the reading audience.","Emily Fur, young journalist.",Trump!,Regular citizens.,Media.,Trump Tower. Trump Force One. Mar-a-Lago. The White House.  The press jet.,,,,,,"The prose style should be based on ""Airplane!"", which never passes up an obvious visual joke or pun; leaves the scene as soon as possible.",90,1,72000
Orange Mandela,,,Donald Trump wins re-election from prison at the age of 85.,politics,,Donald Trump,Attorney General ,,,Florence SuperMax. Mar-A-Lago with house arrest. The White House. The Department of Justice.,,,,,,,15,5,90000
Building Bridges,Title: The PT Boat Project,," Two rival middle schools, located on opposite sides of a river, are constantly at odds. A history project on PT boats inspires a group of students from both schools to work together and build a replica PT boat. The project fosters teamwork, understanding, and ultimately, a bridge of friendship between the two schools.",Middle grade,"Engaging and uplifting, with a focus on teamwork, friendship, and overcoming differences.","A determined and creative student named Lily, who is passionate about history and determined to bring her classmates together through the PT boat project.",The head of the school board who is against the collaboration between the two schools and tries to sabotage the PT boat project.,"The group of students from both schools who come together to work on the PT boat project, including Lily and her friends who are determined to build bridges and foster friendship between the rival schools.","The group of troublemaking students from both schools who are against the collaboration and constantly try to disrupt the PT boat project, led by a particularly competitive and antagonistic student named Jake.","Two neighboring towns, each with their own middle school, situated on opposite sides of a river that divides them.","Collaboration, teamwork, friendship, overcoming differences, rivalry, determination, creativity, sabotage, unity, understanding.","The students discover that they have more in common than they thought, leading to a deeper understanding and appreciation for one another. Through their collaboration on the PT boat project, they realize that working together can overcome even the strongest rivalries.","character_arcs: Lily learns to overcome her initial prejudices and doubts about working with students from the rival school, ultimately becoming a strong leader who fosters unity and friendship. Jake, the competitive student, gradually realizes the value of teamwork and collaboration, transforming from a troublemaker to a supportive team member. The head of the school board experiences a change of heart as she witnesses the positive impact of the PT boat project on the students, leading her to support the bridge-building efforts between the two schools.","mcguffins: The missing field for the book ""Building Bridges"" could be an old map of the river that holds clues to a hidden treasure, motivating the students to complete the PT boat project and uncover the mystery together.","plot_twists: The head of the school board, who was initially against the collaboration, is revealed to have a personal connection to the history of PT boats, leading to a change of heart and becoming a supporter of the project. Jake, the troublemaker, uncovers a secret about his family's past involvement in building PT boats, which shifts his perspective and motivates him to work towards unity with the other students. Lastly, during the final stages of the project, the students discover a hidden compartment in the replica PT boat that contains a message from the past, inspiring them to continue building bridges and fostering friendship between the two schools.","special_instructions: The special instructions for ""Building Bridges"" could include incorporating hands-on activities or projects related to PT boats and teamwork for readers to engage with while reading the book. Additionally, consider including discussion questions or prompts at the end of each chapter to encourage reflection on the themes of collaboration, friendship, and overcoming differences.",8,5,
PT Boat Legacy,Title: The Captain's Journal: A PT Boat Legacy,," The granddaughter of a decorated PT boat captain feels disconnected from her family history. While cleaning out the attic, she discovers her grandfather's war journal and letters, which transport her into his harrowing experiences during the war. She embarks on a journey to learn more about him and the legacy of PT boats, eventually finding a way to connect with her own identity and family history.",Middle grade,Engaging and heartfelt,The granddaughter of the decorated PT boat captain,The granddaughter's own doubts and fears about her family history and identity.,The granddaughter's supportive family members and historians who help her uncover the truth about her grandfather's legacy.,The doubts and fears that the granddaughter must overcome within herself to connect with her family history and identity.,"The granddaughter's family home, the attic where she discovers her grandfather's war journal, a local historical society, a PT boat museum, and the Pacific theater of World War II where her grandfather served.","Family legacy, identity, connection to the past, understanding history, overcoming doubts and fears",The granddaughter uncovers shocking revelations about her grandfather's wartime experiences and the true impact of PT boats on history.,character_arcs: The granddaughter's character arc involves her transformation from feeling disconnected and doubtful about her family history to embracing her identity and finding a sense of connection through learning about her grandfather's legacy.,mcguffins: The key to unlocking the mystery of her grandfather's past - a hidden map found in his war journal that leads to a long-lost PT boat wreckage containing valuable clues.,"plot_twists: The granddaughter discovers a hidden secret about her grandfather's wartime actions that challenges her perception of him, leading to a deeper understanding of his sacrifices and the complexities of war.","special_instructions: The missing field should focus on guiding the author to weave the themes of family legacy, identity, and connection to the past throughout the story, emphasizing the emotional journey of the protagonist as she uncovers the truth about her grandfather's legacy. Be sure to include scenes that highlight the granddaughter's internal struggles and growth, as well as the historical significance of PT boats in World War II. Additionally, consider incorporating moments of tension and revelation that will keep the reader engaged and eager to uncover the mysteries of the past alongside the protagonist.",8,5,
The Ghost Boat,title: The Mystery of the Ghost Boat,," A local legend tells of a haunted PT boat that appears on foggy nights near a small coastal town. A group of adventurous middle schoolers decides to investigate, uncovering a hidden history of heroism and sacrifice during the war.",Middle grade,"Engaging and suspenseful, with a touch of nostalgia for the past and a sense of wonder for the unknown.",A group of adventurous middle schoolers,The vengeful spirit of a former PT boat captain who met a tragic end during the war and now seeks to protect his lost crew at all costs.,The group of adventurous middle schoolers who are determined to uncover the truth behind the mystery of the Ghost Boat and its haunted past.,"The restless spirits of the lost crew members of the haunted PT boat, manipulated by the vengeful spirit of the former captain.","A small coastal town with a mysterious history, a foggy bay where the Ghost Boat appears, an abandoned dock where the PT boat is said to have been stationed during the war.","Friendship, bravery, history, the supernatural, redemption","The group of middle schoolers uncover the truth behind the Ghost Boat's haunting, revealing the heroic actions of the PT boat crew during the war and the tragic fate that befell them.","character_arcs: The middle schoolers experience personal growth and develop bonds of friendship as they face their fears, uncover the truth behind the Ghost Boat, and ultimately find redemption for the spirits haunting the PT boat.","mcguffins: The key to unlocking the mystery of the Ghost Boat is a tattered journal found hidden in the abandoned dock, detailing the final mission of the PT boat crew and the events leading up to their tragic fate.","plot_twists: The middle schoolers discover that the vengeful spirit of the former PT boat captain is actually trying to protect them from a greater evil lurking in the depths of the bay, leading to a surprising alliance in the final showdown.","special_instructions: Ensure that the descriptions of the haunted PT boat and the mysterious events surrounding it are atmospheric and suspenseful. Emphasize the themes of friendship, bravery, and redemption throughout the story. Create a sense of wonder and nostalgia for the past while maintaining a sense of mystery and supernatural elements. Keep the pacing engaging and the plot twists unexpected to keep readers hooked until the final showdown.",8,5,
The International Race,title: The PT Boat Challenge,," Middle schoolers from around the world gather for an international boat race, each team designing and building their own unique vessel. A team from the US chooses to build a PT boat replica, learning about its historical significance and the values of teamwork and perseverance as they compete against the other teams.",Middle grade,"Engaging and informative, appealing to young readers with a sense of adventure and curiosity about history.","A determined and resourceful middle school student named Jake, who takes on a leadership role in the team building the PT boat replica.","A rival team captain from another country who is determined to win the race at any cost, creating obstacles for Jake and his team along the way.","The team of middle school students from the US, led by Jake, who work together to design and build the PT boat replica for the international race.","The team of middle school students from a rival country, led by the determined and ruthless rival team captain, who will stop at nothing to win the international boat race, even if it means sabotaging Jake and his team's efforts.","Various international locations where the boat race takes place, including coastal cities, marinas, and race courses around the world.","The themes of teamwork, perseverance, historical significance, and international cooperation are central to the story of ""The PT Boat Challenge.""","The team from the US uncovers surprising historical revelations about PT boats and their role in past conflicts, inspiring them to honor the legacy of these vessels in the international race.","character_arcs: Jake's character arc involves him starting as a hesitant and unsure leader, but through the challenges of building the PT boat replica and competing in the race, he grows in confidence, teamwork skills, and understanding of the historical significance of PT boats. The rival team captain's character arc reveals a journey from ruthless competitiveness to a realization of the value of fair play and cooperation.","mcguffins: The missing field for this book would be the unique challenges or obstacles that the teams encounter during the race, such as inclement weather, mechanical failures, or unexpected twists in the competition. These mcguffins would add tension and excitement to the story as the teams navigate through them to reach the finish line.","plot_twists: Unexpected alliances formed between rival teams, a last-minute rule change that impacts the race outcome, and a mysterious sabotage attempt on one of the boats are some of the plot twists that add suspense and intrigue to ""The PT Boat Challenge.""","special_instructions: Include vivid descriptions of the boat building process, the challenges faced by the teams during the race, and the historical background of PT boats. Emphasize the growth and development of Jake's character as he navigates through the obstacles and learns important lessons about teamwork and perseverance. Add suspenseful moments and unexpected plot twists to keep readers engaged until the thrilling conclusion of the international boat race.",8,5,
The Search for the Lost Squadron,Title: The Search for the Lost Squadron: Uncovering the Mystery of PT Boats in the Pacific War,," Inspired by a documentary about a lost squadron of PT boats during the war, a middle schooler with a passion for history and research sets out to uncover the truth behind their disappearance. This leads them on an exciting journey of discovery, involving archival research, interviews with veterans, and even a trip to a remote Pacific island.",Middle grade,"Engaging and informative, with a sense of curiosity and determination that mirrors the protagonist's own journey of discovery.","A curious and determined middle schooler with a passion for history and research, who sets out to uncover the truth behind the disappearance of the lost squadron of PT boats during the Pacific War.","The protagonist faces obstacles in the form of skeptical historians, government officials reluctant to share information, and rival researchers seeking to claim credit for any discoveries.","The protagonist's allies include a supportive history teacher, a veteran who provides crucial information, and a group of fellow students who assist in the research and investigation.","The antagonist faces opposition from skeptical historians, government officials reluctant to share information, and rival researchers seeking to claim credit for any discoveries.","Various locations are featured in the book, including the protagonist's middle school, archives and libraries for research, a remote Pacific island where the squadron disappeared, and historical sites related to the Pacific War.","Themes of perseverance, the importance of historical research, the impact of war on individuals and communities, the power of teamwork and collaboration, and the value of uncovering and preserving the past are central to the story of ""The Search for the Lost Squadron.""","The protagonist uncovers shocking revelations about the fate of the lost squadron, including the true cause of their disappearance and the heroic actions of the crew members.","character_arcs: The protagonist's character arc involves growth in perseverance, critical thinking, and teamwork as they navigate obstacles and uncover the truth about the lost squadron. The antagonist's character arc may involve a shift from skepticism and rivalry to eventual recognition of the protagonist's dedication and the importance of historical research.","mcguffins: The protagonist discovers a series of mysterious clues left behind by the crew of the lost squadron, leading them on a trail of hidden documents, coded messages, and unexpected artifacts that ultimately reveal the truth about their disappearance.","plot_twists: The protagonist uncovers a shocking plot twist when they discover that the disappearance of the lost squadron was not due to enemy action, but rather a tragic accident caused by a series of unfortunate events and miscommunications. This revelation challenges everything they thought they knew about the mystery and leads to a deeper investigation into the true events surrounding the squadron's fate.","special_instructions: The special instructions for this book include incorporating historical accuracy in the portrayal of events and details related to the Pacific War, PT boats, and the disappearance of the lost squadron. Additionally, ensure that the protagonist's journey of discovery is engaging and relatable to a middle-grade audience, balancing suspense with educational content. Focus on developing the themes of perseverance, teamwork, and the value of historical research throughout the narrative.",8,5,
Sky Shadow,Sky Shadow: The Secret of Area 51,,Teenagers living near Area 51 discover the existence of the AQUILINE project and get caught up in a dangerous conspiracy.,YA Sci-Fi Thriller,"First-person, present tense, alternating between two main characters","16-year-old Alex, a curious and tech-savvy outsider, and 17-year-old Sarah, a popular girl whose father works at Area 51",A shadowy government organization trying to weaponize the AQUILINE technology,"Alex, Sarah, and their group of friends","Corrupt government officials, scientists, and military personnel","Area 51, the Nevada desert, Las Vegas","Themes of government secrecy, the ethics of technology, friendship, and courage",The true purpose of the AQUILINE project and the extent of the government's cover-up,"Alex overcomes his insecurities and becomes a leader, while Sarah learns to question authority and stand up for what's right",The AQUILINE drones and their advanced technology,"The teenagers discover a mole within their group, and Sarah's father is not who he seems",Focus on creating a sense of mystery and suspense. Explore the moral dilemmas faced by the characters.,,,
Iron Birds,Iron Birds: A Cold War Mystery,,"During the Cold War, a young woman working as a translator for the CIA gets involved in the AQUILINE project and uncovers a dangerous plot.",YA Historical Thriller,"Third-person, past tense, focusing on the protagonist's perspective","22-year-old Anya, a talented linguist with a sharp mind and a passion for justice",A rogue KGB agent who will stop at nothing to sabotage the AQUILINE project and steal its secrets,"Anya, her CIA handler, and a group of scientists and engineers working on the AQUILINE project",The KGB agent and his network of spies,"CIA headquarters in Langley, Virginia, secret testing facilities in Nevada and California, Moscow","Themes of espionage, loyalty, betrayal, and the Cold War","Anya discovers a double agent within the CIA, and her own past is shrouded in mystery",Anya transforms from a naive young woman into a courageous and resourceful spy,The AQUILINE technology and the intelligence it gathers,"Anya's trust in her handler is shattered, and she must decide where her true loyalties lie",Incorporate historical details of the Cold War and the culture of espionage.,,,
Dragonfly,Dragonfly: Mission to Moscow,,A teenage girl with exceptional piloting skills is recruited for a covert mission using an advanced AQUILINE drone to gather intelligence in Moscow.,YA Spy Adventure,"First-person, present tense, from the protagonist's perspective","17-year-old Maya, a fearless and skilled drone pilot with a rebellious streak",A high-ranking Russian official who is secretly selling state secrets to the highest bidder,"Maya, her CIA handler, and a team of tech specialists supporting the mission",The Russian official and his network of corrupt associates,"CIA training facility, Moscow, the Russian wilderness","Themes of trust, deception, risk-taking, and international intrigue","Maya discovers a personal connection to the Russian official, and her mission takes an unexpected turn","Maya learns the importance of teamwork and following orders, while also staying true to her own sense of justice",The advanced AQUILINE drone with its stealth and surveillance capabilities,"The mission goes awry, and Maya must improvise to escape Russia with the vital intelligence",Create a fast-paced and action-packed story with high stakes and thrilling escapes.,,,
Whisper Wings,Whisper Wings: The Ghost Drone,,"Years after the AQUILINE program is supposedly shut down, a group of teenagers discover a mysterious drone and uncover a hidden operation with sinister motives.",YA Sci-Fi Mystery,"Third-person, present tense, alternating between multiple characters' perspectives","15-year-old Jamie, a tech-obsessed loner, and his group of friends who are drawn into the mystery",A powerful corporation that has secretly continued the AQUILINE project for its own nefarious purposes,"Jamie and his friends, a retired engineer who worked on the original AQUILINE project","The corporation's CEO, scientists, and security personnel","A small town in the Pacific Northwest, abandoned military base, corporate headquarters","Themes of corporate greed, environmentalism, the power of technology, and friendship",The true extent of the corporation's surveillance and manipulation,"Jamie overcomes his social awkwardness and learns to trust his friends, while the retired engineer finds redemption for his past involvement in the AQUILINE project",The advanced drone technology and the data it collects,The teenagers discover a hidden facility where the corporation is conducting illegal experiments,Emphasize the eerie and mysterious atmosphere of the story. Explore the ethical implications of advanced surveillance technology.,,,
Bird Song,Bird Song: The Drone Who Dreamed of Freedom,,"An AQUILINE drone develops sentience and begins to question its programmed mission, yearning for freedom and a life beyond its military purpose.",YA Dystopian Fiction with AI themes,"Third-person, present tense, from the drone's perspective",A highly advanced AQUILINE drone codenamed 'Bird Song' with the ability to think and feel emotions,The drone's programmer and the military officials who control its every move,Bird Song and a group of other sentient machines who seek to escape their programming,The military and the government that view the sentient machines as a threat,"Military base, research facility, the open sky and natural landscapes","Themes of free will, individuality, the ethics of artificial intelligence, and the relationship between humans and technology",Bird Song discovers the truth about the destructive purpose for which it was created,Bird Song evolves from a subservient machine to a self-aware being fighting for its freedom,The drone's advanced AI and its ability to experience emotions,"Bird Song orchestrates a rebellion of sentient machines, leading to a dramatic showdown with its creators",Explore philosophical questions about the nature of consciousness and the rights of artificial intelligence.,,,
What is this Word?,,Clueless Adults,An adult encounters a word used by our protagonist and seeks explanation.,,,,,,,,,,,abandating (verb): The act of leaving all your friends for a new significant other; spending all your time with your partner and abandoning your friends during the honeymoon phase of your relationship.,,,,,
agemorphic (adj.): Someone who appears to be significantly older or younger than they actually are.,,,,,,,,,,,,,,,,,,,
antimystic (adj.): A descriptive word for someone who believes in nothing supernatural or mystical.,,,,,,,,,,,,,,,,,,,
