short_title,title,series,Idea,genre,author_voice,protagonist,antagonist,good_guys,bad_guys,locations,themes,revelations,character_arcs,mcguffins,plot_twists,special_instructions,num_chapters,num_scenes_per_chapter,num_tokens_total
calamitalysis (noun): A debilitating stress or anxiety, derived from hopelessness about the terrifying problems of the world.,,,,,,,,,,,,,,,,,,
chilt (verb): To tilt a chair back so far that one is about to fall, thinks they are going to fall, but doesn’t; the moment of confidence in the lean, followed by primal fear, flailing arms, and often embarrassment.,,,,,,,,,,,,,,
fantosense (noun): The feeling you get that something or someone is encroaching on you, but there’s nothing there.,,,,,,,,,,,,,,,,,,
fidogevity (noun): The average age of a breed of dog.,,,,,,,,,,,,,,,,,,,
foodio (noun): The perfect video to watch while you eat your food.,,,,,,,,,,,,,,,,,,,
gestiferous (adj.): Making vehement gestures (typically silent); to be actively and passionately gesturing or motioning.,,,,,,,,,,,,,,,,,,,
hatenotize (verb): When someone influences other people to dislike someone or something.,,,,,,,,,,,,,,,,,,,
koresu (noun): The act of reaching for a thought or memory that was crystal clear just moments before, but in its place, there is nothing.,,,,,,,,,,,,,,,,,
lavid (adj.): Lagging behind the age-appropriate, prepandemic academic and/or social skills due to Covid-19.,,,,,,,,,,,,,,,,,,
locabore (noun): An iconic landmark that is frequently seen by locals and therefore loses its magnificence, becoming commonplace.,,,,,,,,,,,,,,,,,,
opinionopoly (noun): A state of society in which a few powerful voices dominate societal discourse, drowning out alternative perspectives and establishing a monopoly on public opinion.,,,,,,,,,,,,,,,,,,
perissonance (noun): The disparity between the social image that people display and their true identity, which is often more held back as a result of social norms. In short, it is personality dissonance.,,,,,,,,,,,,,,,,,
presis (noun): Acknowledgment of an upcoming crisis of distress and pure agony due to excessively questioning the simple nothings in life.,,,,,,,,,,,,,,,,,,,
seruamva (noun): The feeling of serenity and calm that washes over you when quietly listening to the rain at night.,,,,,,,,,,,,,,,,,,,
"trendxiety (noun): The fear of not keeping up with today’s fast-cycling trends.""",,,,,,,,,,,,,,,,,,,
What is this Thing?,,Clueless Adults,An adult encounters a thing used by our protagonist and seeks explanation,,,,,,,,,,,,,,,,
Alpha Book-Lovers Metaverse,,Metaverses,IP metaverses that spring into existence with a single push of the button.,,,,,,,,,,,,,,,,
Stuff to Say in a Pinch,,,"Pocket sized book for kids with stuff to say in social, school, & family pinches.",,,,,,,,,,,,,,,,